{
    "$schema": "http://json-schema.org/draft-04/schema#",
    "description": "",
    "type": "object",
    "properties": {
        "$schema": {
            "type": "string",
            "minLength": 1
        },
        "title": {
            "type": "string",
            "minLength": 1
        },
        "login": {
            "type": "string",
            "minLength": 1
        },
        "error-500": {
            "type": "string",
            "minLength": 1
        },
        "error-404": {
            "type": "string",
            "minLength": 1
        },
        "error-403": {
            "type": "string",
            "minLength": 1
        },
        "success": {
            "type": "string",
            "minLength": 1
        }
    },
    "required": [
        "$schema",
        "title",
        "login",
        "error-500",
        "error-404",
        "error-403",
        "success"
    ],
    "additionalProperties": false
}