{
    "$schema": "../schemas/forgot-password.json",
    "title": "Şifremi Unuttum",
    "login": "Giriş yap",
    "error-500": "Bir şeyler yanlış gitti. Lütfen tekrar deneyin.",
    "error-404": "Böyle bir hesap bulunmamaktadır.",
    "error-403": "Bu hesap henüz doğrulanmadı. Hesabınızı doğrulamak için lütfen e-postanızı kontrol edin.",
    "success": "Parolanızı sıfırlamak için bir bağlantı için e-postanızı kontrol edin. Birkaç dakika içinde görünmezse spam klasörünüzü kontrol edin."
}