{
    "$schema": "../schemas/forgot-password.json",
    "title": "Forgot Password",
    "login": "Log in",
    "error-500": "Something went wrong. Please try again.",
    "error-404": "No account with this email.",
    "error-403": "This account is not verified. Please check your email to verify your account.",
    "success": "Check your email for a link to reset your password. If it doesnâ€™t appear within a few minutes, check your spam folder."
}